{
  "objectType": "shipment_eligibility_certificate",
  "objectName": "Shipment Eligibility Certificate",
  "policyPackId": "tasc-ga-procurement-objects",
  "policyPackVersion": "0.3.0",
  "inputHash": "sha256:d4d02d62305f6ceb3e21c9bceadc068fd86c63620d426c110f8c607b049bbd7a",
  "bundleDigest": "sha256:7b38b17dfc98bcfb74cb9276c45d8755ba71ebc363b6a0908d075380e9943670",
  "signer": {
    "signerKeyId": "kid:shipment-eligibility-ta2",
    "trustAnchorLevel": "TA2",
    "keySource": "PKCS11",
    "signerCertificatePath": "policies/attestation/pki/ta2-signer.cert.pem",
    "certificateChainPath": "policies/attestation/pki/ta2-chain.pem",
    "signatureAlgorithm": "rsa-sha256",
    "signatureEncoding": "base64"
  },
  "validity": {
    "notBeforeUtc": "2026-02-16T14:44:26Z",
    "notAfterUtc": "2026-03-18T14:44:26Z"
  },
  "verifierInstructions": {
    "command": "tasc-verify verify --bundle <bundle> --profile <profile> --policy eu-north-star --require-ta TA2 --require-transparency rekor,mirror",
    "requiredChecks": [
      "CHK_PROCUREMENT_OBJECT_REQUIRED_SET",
      "CHK_PROCUREMENT_OBJECT_ARTIFACT_PARITY",
      "CHK_PROCUREMENT_OBJECT_INPUT_HASH",
      "CHK_PROCUREMENT_OBJECT_BUNDLE_BINDING",
      "CHK_PROCUREMENT_OBJECT_SIGNATURE",
      "CHK_PROCUREMENT_OBJECT_TRUST_FLOOR",
      "CHK_PROCUREMENT_OBJECT_VALIDITY_WINDOW"
    ]
  },
  "signatureEnvelope": {
    "payloadDigest": "sha256:489149a33846b853b3c262d03833045f7c2203e9376b182628b962e03e070611",
    "signedAtUtc": "2026-02-16T14:44:26Z",
    "signature": "ptAiBKpzG+bqLKcRXSlhF/UgvOGcqa77KhXAQa3qkjk8X1hDzuYEkQE/YJQjx0I9ddaNgnDq/U4J18Au0SIm3ufduMmTNpJWuH9tTiVBvAanAqc9XvcUcoWjaL7PKYjOPLWEkTFL2uFl6S3BHBJfWVweOQFxbLovIx+cVWbszOE8LCE6vEaQ6H8bGkY0PMDK4hG9hdP3z0fH8OrG5+STFW7sNw9MDaqHCdVJ1mwucg5hSGXF2h75V0gCOgoDb2hcWh0D6GinLXzEbq/dspEBSfOLmd4vMMeB5j0kgRnv+7Fm9y9fimuQ/vm/HPt+XJxF9A1nGBNTIvwQMb+12/vgZQ=="
  },
  "artifactRef": {
    "path": "shipment-eligibility-certificate-uas-small.json",
    "sha256": "sha256:0299b66ed67412ceb57d8975266c078e066204179f5d3fcc706b88fb995e11bf"
  },
  "inputs": {
    "profile": "uas-small",
    "policy": "eu-north-star",
    "lifecycleStage": "active",
    "objectKey": "shipmentEligibilityCertificate",
    "objectType": "shipment_eligibility_certificate",
    "objectName": "Shipment Eligibility Certificate",
    "evidenceMapDigest": "sha256:8a746ac899fda794a89fae22b0d35be7c3573d8810c537fe37e60036cf043b3d",
    "attestationDigest": "sha256:d4cc2d9c2342036cc6f8362aacec6750d482df6cba9ab4152df5cce79eaf03a9",
    "signedOperationalLogRoot": "sha256:3511e71c0a4c216c1b529242a3fae3e458ccff9a54db5ac0338ecf4541326385",
    "badgeId": "badge-uas-small-active",
    "requiredTransparency": [
      "rekor",
      "mirror"
    ]
  }
}
