{
  "objectType": "underwriter_confidence_packet",
  "objectName": "Underwriter Confidence Packet",
  "policyPackId": "tasc-ga-procurement-objects",
  "policyPackVersion": "0.3.0",
  "inputHash": "sha256:4911af9386b47d9753903495ec8722be1eeff577f984b0d615ab3d7af1b8df3c",
  "bundleDigest": "sha256:7ac36f8e062a562b8d0109effe1808a7a4106802261e5c28677c579a0676bce8",
  "signer": {
    "signerKeyId": "kid:underwriter-confidence-ta2",
    "trustAnchorLevel": "TA2",
    "keySource": "PKCS11",
    "signerCertificatePath": "policies/attestation/pki/ta2-signer.cert.pem",
    "certificateChainPath": "policies/attestation/pki/ta2-chain.pem",
    "signatureAlgorithm": "rsa-sha256",
    "signatureEncoding": "base64"
  },
  "validity": {
    "notBeforeUtc": "2026-02-16T14:44:31Z",
    "notAfterUtc": "2026-03-18T14:44:31Z"
  },
  "verifierInstructions": {
    "command": "tasc-verify verify --bundle <bundle> --profile <profile> --policy eu-north-star --require-ta TA2 --require-transparency rekor,mirror",
    "requiredChecks": [
      "CHK_PROCUREMENT_OBJECT_REQUIRED_SET",
      "CHK_PROCUREMENT_OBJECT_ARTIFACT_PARITY",
      "CHK_PROCUREMENT_OBJECT_INPUT_HASH",
      "CHK_PROCUREMENT_OBJECT_BUNDLE_BINDING",
      "CHK_PROCUREMENT_OBJECT_SIGNATURE",
      "CHK_PROCUREMENT_OBJECT_TRUST_FLOOR",
      "CHK_PROCUREMENT_OBJECT_VALIDITY_WINDOW"
    ]
  },
  "signatureEnvelope": {
    "payloadDigest": "sha256:e5e1c296a7e55ecd74ed43c928df9cfb9300ddcb7133e2501729c9769f5dd9f3",
    "signedAtUtc": "2026-02-16T14:44:31Z",
    "signature": "x6rMVenqOpBLr2sD/sQNTHRRmAP07/3uMt63R6J07XkLg/IMMKCfoyD2j/wF1M03N7ve+cWM2KofqS1feLsLbuWDpHyjhGssj2P3ajQDv2K8L7jofHzSrz3vkb5Smw16n6gNR7cD8vOFdjtYGm9JjCn7yPmFLa0nm68punzOG2NA56MC+bZyQb33WCofr8TmaLzCgEo7vGF7g9aDa5nChAemHp80FmIOZvA32w2bENc4ryGabuZstT3v09/EOXM6JUM7ou3m57UPNtmzwPRNZifbWlbLEtt8TrKdwIlWYgOp5dipc5q76Tl3I1LPmxFevD561ySXq6jKH2MoCwdbmQ=="
  },
  "artifactRef": {
    "path": "underwriter-confidence-packet-fixed-wing.json",
    "sha256": "sha256:947680bece0ca3a77cc9aec9072b117d6c5cd68aa64287ba347d7aae4ab4782d"
  },
  "inputs": {
    "profile": "fixed-wing",
    "policy": "eu-north-star",
    "lifecycleStage": "active",
    "objectKey": "underwriterConfidencePacket",
    "objectType": "underwriter_confidence_packet",
    "objectName": "Underwriter Confidence Packet",
    "evidenceMapDigest": "sha256:402efe446e3c47b56b3d9dc25dddf5893514de7d38e9e5dd9aa776fc611f7ad6",
    "attestationDigest": "sha256:bb9d72e0dd9d0db37bf194095fa1dbb0ea2dc58e19f42e6e3be53c14a8a5807a",
    "signedOperationalLogRoot": "sha256:d40503f489518c207e4c0e81e96dd1a4307e9f51abc687dfc9029c8abdc73172",
    "badgeId": "badge-fixed-wing-active",
    "requiredTransparency": [
      "rekor",
      "mirror"
    ]
  }
}
