{
  "objectType": "underwriter_confidence_packet",
  "objectName": "Underwriter Confidence Packet",
  "policyPackId": "tasc-ga-procurement-objects",
  "policyPackVersion": "0.3.0",
  "inputHash": "sha256:3946fdd1510ed0890e6acfbafa747f6665ad61cd651345cd8487e3590066d4d5",
  "bundleDigest": "sha256:7b38b17dfc98bcfb74cb9276c45d8755ba71ebc363b6a0908d075380e9943670",
  "signer": {
    "signerKeyId": "kid:underwriter-confidence-ta2",
    "trustAnchorLevel": "TA2",
    "keySource": "PKCS11",
    "signerCertificatePath": "policies/attestation/pki/ta2-signer.cert.pem",
    "certificateChainPath": "policies/attestation/pki/ta2-chain.pem",
    "signatureAlgorithm": "rsa-sha256",
    "signatureEncoding": "base64"
  },
  "validity": {
    "notBeforeUtc": "2026-02-16T14:44:26Z",
    "notAfterUtc": "2026-03-18T14:44:26Z"
  },
  "verifierInstructions": {
    "command": "tasc-verify verify --bundle <bundle> --profile <profile> --policy eu-north-star --require-ta TA2 --require-transparency rekor,mirror",
    "requiredChecks": [
      "CHK_PROCUREMENT_OBJECT_REQUIRED_SET",
      "CHK_PROCUREMENT_OBJECT_ARTIFACT_PARITY",
      "CHK_PROCUREMENT_OBJECT_INPUT_HASH",
      "CHK_PROCUREMENT_OBJECT_BUNDLE_BINDING",
      "CHK_PROCUREMENT_OBJECT_SIGNATURE",
      "CHK_PROCUREMENT_OBJECT_TRUST_FLOOR",
      "CHK_PROCUREMENT_OBJECT_VALIDITY_WINDOW"
    ]
  },
  "signatureEnvelope": {
    "payloadDigest": "sha256:c3ad7f36b7cfb2d62d61d7e7a995f1dbd722a131a4205c6cd97a50d42a106559",
    "signedAtUtc": "2026-02-16T14:44:26Z",
    "signature": "Kkc1HexNC8Nqzakwvz4EI0xTyojWvB5/RDnjlLeKz7y4MoaH1znqWgHRjc4UC03x7fN7AZocu0ioyVXZ2gvrjDVWgzc6jNmXgZR5Iqot2c66nDygyg9cUqiP2l9lZ3F0uBEHQykKgFF+ckIRTLmymPSAzeq1pCqjMpQhs0nJsuQrV/yDcnWuUFMQyeLNjSbGKBz2tlfQpNt31yvQ7Z/xKXtPl2gyoyOJNCEu9zXTOZ7Dxi+5iIoLbTdoS+01nl22cKYuJZ2dOeY3c/nOPtIA2/M3n0+PL4bf8qTvJGX8RNzL66fv79YFjSamMfJLY+YjtgCVD24PMdbcPEVjTzl3Dw=="
  },
  "artifactRef": {
    "path": "underwriter-confidence-packet-uas-small.json",
    "sha256": "sha256:5b617a1d3f6f28f48269dace6c5b62d9ef9e46b9fc925f12e529010b5b7a7eef"
  },
  "inputs": {
    "profile": "uas-small",
    "policy": "eu-north-star",
    "lifecycleStage": "active",
    "objectKey": "underwriterConfidencePacket",
    "objectType": "underwriter_confidence_packet",
    "objectName": "Underwriter Confidence Packet",
    "evidenceMapDigest": "sha256:8a746ac899fda794a89fae22b0d35be7c3573d8810c537fe37e60036cf043b3d",
    "attestationDigest": "sha256:d4cc2d9c2342036cc6f8362aacec6750d482df6cba9ab4152df5cce79eaf03a9",
    "signedOperationalLogRoot": "sha256:3511e71c0a4c216c1b529242a3fae3e458ccff9a54db5ac0338ecf4541326385",
    "badgeId": "badge-uas-small-active",
    "requiredTransparency": [
      "rekor",
      "mirror"
    ]
  }
}
