{
  "objectType": "shipment_eligibility_certificate",
  "objectName": "Shipment Eligibility Certificate",
  "policyPackId": "tasc-ga-procurement-objects",
  "policyPackVersion": "0.3.0",
  "inputHash": "sha256:645c58720d427c06fdb7c07220ae8c970e9e10a3267880ba904708937afae43f",
  "bundleDigest": "sha256:6afe7ca56f1d36ca282e6a7df20c27931abfb27bc6f45764fb754f8cf1fe1220",
  "signer": {
    "signerKeyId": "kid:shipment-eligibility-ta2",
    "trustAnchorLevel": "TA2",
    "keySource": "PKCS11",
    "signerCertificatePath": "policies/attestation/pki/ta2-signer.cert.pem",
    "certificateChainPath": "policies/attestation/pki/ta2-chain.pem",
    "signatureAlgorithm": "rsa-sha256",
    "signatureEncoding": "base64"
  },
  "validity": {
    "notBeforeUtc": "2026-02-16T14:44:34Z",
    "notAfterUtc": "2026-03-18T14:44:34Z"
  },
  "verifierInstructions": {
    "command": "tasc-verify verify --bundle <bundle> --profile <profile> --policy eu-north-star --require-ta TA2 --require-transparency rekor,mirror",
    "requiredChecks": [
      "CHK_PROCUREMENT_OBJECT_REQUIRED_SET",
      "CHK_PROCUREMENT_OBJECT_ARTIFACT_PARITY",
      "CHK_PROCUREMENT_OBJECT_INPUT_HASH",
      "CHK_PROCUREMENT_OBJECT_BUNDLE_BINDING",
      "CHK_PROCUREMENT_OBJECT_SIGNATURE",
      "CHK_PROCUREMENT_OBJECT_TRUST_FLOOR",
      "CHK_PROCUREMENT_OBJECT_VALIDITY_WINDOW"
    ]
  },
  "signatureEnvelope": {
    "payloadDigest": "sha256:92dd0d90d1ccab96edde20f5b3e2ff6a4c196b3e76259a26567d259a1246faba",
    "signedAtUtc": "2026-02-16T14:44:34Z",
    "signature": "JYXI1SuvDHgjbl51+R0yIPZnbrgegPVWE3SZ8YACmhCra3IFrq6gq7OMRMYXV2xr6WoUS4vrMuFOMQ818T5nKSjUTuOnz0DyFQl7rcN/Pw6gEGrrSL6b5mS3f70zZ+GATxOln2By/9CH2HD1XM/NGsaXrC1huzenCsrqsJHg4EVWYqZYwzEkc2m1HNohUr0UYzGQ6Bx8bBr5wnAzLHoIeZ9sI5TxbwArE4NvO2U62tRNCbjwY2bBqIRhaq3L9H/iVbOmmGN7xjzqHK+fqVDmBBG60Ngz6MmmcB96whvclR2vS0zv+eH1lBJNft+G/HA8gaIC/gQPGycZUuvM22jtCQ=="
  },
  "artifactRef": {
    "path": "shipment-eligibility-certificate-hybrid-vtol.json",
    "sha256": "sha256:b5477d3bdfd7a7f9aed147e756a0bb1db33b9da1f31ad2659b40f7851aae9894"
  },
  "inputs": {
    "profile": "hybrid-vtol",
    "policy": "eu-north-star",
    "lifecycleStage": "active",
    "objectKey": "shipmentEligibilityCertificate",
    "objectType": "shipment_eligibility_certificate",
    "objectName": "Shipment Eligibility Certificate",
    "evidenceMapDigest": "sha256:310415d819f4622e99ed694ec68eec54c582d2623a29b486f1032ca9a4afe1ca",
    "attestationDigest": "sha256:a6f16947770e575f998e3ef47d709e84ab28fff604402b8bd310654f1d74bb36",
    "signedOperationalLogRoot": "sha256:202c3ceaad6945c3338395de7cfd866155c1e2eebe50c0b87bdcc4cef4ac038d",
    "badgeId": "badge-hybrid-vtol-active",
    "requiredTransparency": [
      "rekor",
      "mirror"
    ]
  }
}
