{
  "objectType": "procurement_bid_packet",
  "objectName": "Procurement Bid Packet",
  "policyPackId": "tasc-ga-procurement-objects",
  "policyPackVersion": "0.3.0",
  "inputHash": "sha256:ebfd285e010cd76133a9ac6c2a3a6e3c7a862f7cbf3434f37096758e33145eb7",
  "bundleDigest": "sha256:13f990f23260aa54c6d33838c28f522a27765402851dceb23bcb2a016b73f675",
  "signer": {
    "signerKeyId": "kid:procurement-bid-ta2",
    "trustAnchorLevel": "TA2",
    "keySource": "PKCS11",
    "signerCertificatePath": "policies/attestation/pki/ta2-signer.cert.pem",
    "certificateChainPath": "policies/attestation/pki/ta2-chain.pem",
    "signatureAlgorithm": "rsa-sha256",
    "signatureEncoding": "base64"
  },
  "validity": {
    "notBeforeUtc": "2026-02-13T07:04:03Z",
    "notAfterUtc": "2026-03-15T07:04:03Z"
  },
  "verifierInstructions": {
    "command": "tasc-verify verify --bundle <bundle> --profile <profile> --policy eu-north-star --require-ta TA2 --require-transparency rekor,mirror",
    "requiredChecks": [
      "CHK_PROCUREMENT_OBJECT_REQUIRED_SET",
      "CHK_PROCUREMENT_OBJECT_ARTIFACT_PARITY",
      "CHK_PROCUREMENT_OBJECT_INPUT_HASH",
      "CHK_PROCUREMENT_OBJECT_BUNDLE_BINDING",
      "CHK_PROCUREMENT_OBJECT_SIGNATURE",
      "CHK_PROCUREMENT_OBJECT_TRUST_FLOOR",
      "CHK_PROCUREMENT_OBJECT_VALIDITY_WINDOW"
    ]
  },
  "signatureEnvelope": {
    "payloadDigest": "sha256:f00d28082a2e8d63dd50e9c0931763d58168db933f8c1d8f0ebde6ddb339bf80",
    "signedAtUtc": "2026-02-13T07:04:03Z",
    "signature": "cAnaRzj4c6dWJVbRp2uQmQuP06HM8tqZNuEXSUeTbbLGivFuijRx5tYMV2TE39CpgibzYVP1+DNVDpiL3YyT8Ahd2Rc77wfZ1AKJ6dCi305FhFgNrW/Cyep4pxq1tcXQm5QMJ63SQdNtBSdEffJkYBz1b1ZFyie8xS5ga9zUFIrnGXEUDLCfuo096IHR7ZfDgFHjYjYaU9au1S+nuGRlGlwoMWN3kfXjzJhwZJXHAZsoKUOoWkpNqHrpdzgK5R8VlG9bIU00IiQ5VNrLo35YX/o8mC9GfXAt7PgvZGKUOgEDWpcE42zOFrwHde0jsn3oWdUuWOMl2q+3fRrAfkK9sQ=="
  },
  "artifactRef": {
    "path": "procurement-bid-packet-uas-small.json",
    "sha256": "sha256:dbf170eac3e7c50880c413818c01b7361bd820ec0bca4e0289a52705494f28f7"
  },
  "inputs": {
    "profile": "uas-small",
    "policy": "eu-north-star",
    "lifecycleStage": "active",
    "objectKey": "procurementBidPacket",
    "objectType": "procurement_bid_packet",
    "objectName": "Procurement Bid Packet",
    "evidenceMapDigest": "sha256:5a5b4d06f89433382f28a545c3f6269d9021c643a5113612cfbd1dc439c6dcfc",
    "attestationDigest": "sha256:a0bc27095f47e6520522d211ad0471d2667fd04bd37a2d6850b62c146116b0b3",
    "signedOperationalLogRoot": "sha256:3511e71c0a4c216c1b529242a3fae3e458ccff9a54db5ac0338ecf4541326385",
    "badgeId": "badge-uas-small-active",
    "requiredTransparency": [
      "rekor",
      "mirror"
    ]
  }
}
