{
  "objectType": "procurement_bid_packet",
  "objectName": "Procurement Bid Packet",
  "policyPackId": "tasc-ga-procurement-objects",
  "policyPackVersion": "0.3.0",
  "inputHash": "sha256:c549e0b99a5e0fc2d429f9ff3355d8a567ced274a1b22ee5f808fccda7a29b11",
  "bundleDigest": "sha256:7b38b17dfc98bcfb74cb9276c45d8755ba71ebc363b6a0908d075380e9943670",
  "signer": {
    "signerKeyId": "kid:procurement-bid-ta2",
    "trustAnchorLevel": "TA2",
    "keySource": "PKCS11",
    "signerCertificatePath": "policies/attestation/pki/ta2-signer.cert.pem",
    "certificateChainPath": "policies/attestation/pki/ta2-chain.pem",
    "signatureAlgorithm": "rsa-sha256",
    "signatureEncoding": "base64"
  },
  "validity": {
    "notBeforeUtc": "2026-02-16T14:44:27Z",
    "notAfterUtc": "2026-03-18T14:44:27Z"
  },
  "verifierInstructions": {
    "command": "tasc-verify verify --bundle <bundle> --profile <profile> --policy eu-north-star --require-ta TA2 --require-transparency rekor,mirror",
    "requiredChecks": [
      "CHK_PROCUREMENT_OBJECT_REQUIRED_SET",
      "CHK_PROCUREMENT_OBJECT_ARTIFACT_PARITY",
      "CHK_PROCUREMENT_OBJECT_INPUT_HASH",
      "CHK_PROCUREMENT_OBJECT_BUNDLE_BINDING",
      "CHK_PROCUREMENT_OBJECT_SIGNATURE",
      "CHK_PROCUREMENT_OBJECT_TRUST_FLOOR",
      "CHK_PROCUREMENT_OBJECT_VALIDITY_WINDOW"
    ]
  },
  "signatureEnvelope": {
    "payloadDigest": "sha256:2ee4687525c60ee2d149e52c00024266b913c8857c97304278882b031c5f1168",
    "signedAtUtc": "2026-02-16T14:44:27Z",
    "signature": "iJIBl6C0UjKzdjcBDCUW2bjfpS35Tpj1YHbEs4ujq1o8BJlemNdnyCHx60atPDdnIJ82VYoTb0wbyF6SsSumZqqaJP+o8hif4J6q9iSm8ERfvGyExsoPCInMdVWhQ6Y8qh3Z/ZABQkPFH6zVvFsGI5uzueEX1MEyBxLmyGhiEOl7pCiLZOHAsZqxxNDHjkzQYsgneqa/7A5jlkRtXXPbC1PLBo+hn2NAmJhWf9PlMqy0X8HnCms4OCRy7p5xOP4q2UL/mWyn03kQ2IJOlpH89ZXbB1gxdXZeC8pjMwjKEzADAeg/OcP02YyVYLRGQPHYLjjTJhve9z7QR9JdtARHGA=="
  },
  "artifactRef": {
    "path": "procurement-bid-packet-uas-small.json",
    "sha256": "sha256:a77577a3cdd3461f804b063420ad9faeff8420943b596f4a96002affe2f6055a"
  },
  "inputs": {
    "profile": "uas-small",
    "policy": "eu-north-star",
    "lifecycleStage": "active",
    "objectKey": "procurementBidPacket",
    "objectType": "procurement_bid_packet",
    "objectName": "Procurement Bid Packet",
    "evidenceMapDigest": "sha256:8a746ac899fda794a89fae22b0d35be7c3573d8810c537fe37e60036cf043b3d",
    "attestationDigest": "sha256:d4cc2d9c2342036cc6f8362aacec6750d482df6cba9ab4152df5cce79eaf03a9",
    "signedOperationalLogRoot": "sha256:3511e71c0a4c216c1b529242a3fae3e458ccff9a54db5ac0338ecf4541326385",
    "badgeId": "badge-uas-small-active",
    "requiredTransparency": [
      "rekor",
      "mirror"
    ]
  }
}
