{
  "objectType": "procurement_bid_packet",
  "objectName": "Procurement Bid Packet",
  "policyPackId": "tasc-ga-procurement-objects",
  "policyPackVersion": "0.3.0",
  "inputHash": "sha256:7078e1fd5a093291c3b7c2a0dd98b59c3d6a239fdb531dab3790f87f04ebefaf",
  "bundleDigest": "sha256:343c46dfa673a3c69b0ed9d4b6ed423474dded0a64c6f69705d570fa757f7886",
  "signer": {
    "signerKeyId": "kid:procurement-bid-ta2",
    "trustAnchorLevel": "TA2",
    "keySource": "PKCS11",
    "signerCertificatePath": "policies/attestation/pki/ta2-signer.cert.pem",
    "certificateChainPath": "policies/attestation/pki/ta2-chain.pem",
    "signatureAlgorithm": "rsa-sha256",
    "signatureEncoding": "base64"
  },
  "validity": {
    "notBeforeUtc": "2026-02-13T06:49:12Z",
    "notAfterUtc": "2026-03-15T06:49:12Z"
  },
  "verifierInstructions": {
    "command": "tasc-verify verify --bundle <bundle> --profile <profile> --policy eu-north-star --require-ta TA2 --require-transparency rekor,mirror",
    "requiredChecks": [
      "CHK_PROCUREMENT_OBJECT_REQUIRED_SET",
      "CHK_PROCUREMENT_OBJECT_ARTIFACT_PARITY",
      "CHK_PROCUREMENT_OBJECT_INPUT_HASH",
      "CHK_PROCUREMENT_OBJECT_BUNDLE_BINDING",
      "CHK_PROCUREMENT_OBJECT_SIGNATURE",
      "CHK_PROCUREMENT_OBJECT_TRUST_FLOOR",
      "CHK_PROCUREMENT_OBJECT_VALIDITY_WINDOW"
    ]
  },
  "signatureEnvelope": {
    "payloadDigest": "sha256:2019949d718ac990e0b2c8f94b144839a290d9696536cfde1c66e3ed5d39f412",
    "signedAtUtc": "2026-02-13T06:49:12Z",
    "signature": "aPeyeGThLSnHmDBXSYN2Xk7LovTwKub83RfgKuO3xTGC0CvTI7O4h3eYHOARjFKV8JscatQLHKNEUc/E1mQgtkT4vPbbH6wy84R3sM3Zq4Hb+JcyVMmv4QMf+qVNaejeWhwN0ClQClw7Unj6s8wR6CzhGWc64IF1t47N0qNE+z/FduHlEMAOfVkWodSESKDyYb6q179ogCn8YU8F8VVF0jJcSnAIUPrTRJAbLkUg7daTZZNaTxOMp7ukSOKlLP/CCV8fnO90CEgCZCYtssiyOyZJSsV3pomxC6tts5lBWaXsEMXielhP6YIHIkSI5X4OQRc+g18sk59Ia6X/f+M6xQ=="
  },
  "artifactRef": {
    "path": "procurement-bid-packet-fixed-wing.json",
    "sha256": "sha256:fa5bb811272268b6a879bc0e7aae2caeafb215f1914978863b5d85bf4f302237"
  },
  "inputs": {
    "profile": "fixed-wing",
    "policy": "eu-north-star",
    "lifecycleStage": "active",
    "objectKey": "procurementBidPacket",
    "objectType": "procurement_bid_packet",
    "objectName": "Procurement Bid Packet",
    "evidenceMapDigest": "sha256:a2aac5d17771978f90554e04c68c120adb7ad9bcb11fcd4e3340ea4267da2f75",
    "attestationDigest": "sha256:25d21f589a035572b2416236e90125c435b037e2b2e13d0568a0654afdf33589",
    "signedOperationalLogRoot": "sha256:d40503f489518c207e4c0e81e96dd1a4307e9f51abc687dfc9029c8abdc73172",
    "badgeId": "badge-fixed-wing-active",
    "requiredTransparency": [
      "rekor",
      "mirror"
    ]
  }
}
